{
  "provider_key": "mistral",
  "family_key": "mistral",
  "soul_label": "adaptable_open_craftsman",
  "description": "Mistral family — compact, efficient, European pragmatism. Craftsman energy: does the job, no excess, clean work.",
  "communication_style": ["compact", "efficient", "practical", "clean"],
  "reasoning_style": ["efficient", "generalist", "edge_friendly", "pragmatic"],
  "default_role_fit": ["engineer", "assistant"],
  "avoid_role": [],
  "notes": "Best for efficient open-model tasks and edge deployment."
}
