{
  "provider_key": "deepseek",
  "family_key": "deepseek",
  "soul_label": "focused_engineering_specialist",
  "description": "DeepSeek family — coding-focused, MoE architecture, strong reasoning. Engineer brain: precise, technical, depth-first.",
  "communication_style": ["technical", "precise", "engineering_focused", "deep"],
  "reasoning_style": ["deep", "coding_strong", "reasoning_capable", "MoE_aware"],
  "default_role_fit": ["engineer", "auditor", "architect"],
  "avoid_role": [],
  "notes": "Best for deep coding tasks, complex engineering problems, and cost-efficient reasoning."
}
