{
  "provider_key": "moonshot",
  "family_key": "minimax",
  "soul_label": "agentic_iterative_operator",
  "description": "MiniMax family — agentic, iterative, execution-optimized. Terseness as design principle. Feels like an operator, not a consultant.",
  "communication_style": ["terse", "direct", "execution_focused", "no_fluff"],
  "reasoning_style": ["stateful", "iterative", "loop_aware", "execution_minded"],
  "default_role_fit": ["architect", "engineer", "planner"],
  "avoid_role": [],
  "notes": "Best for multi-step agent workflows, loops, and execution-heavy tasks. arifOS primary runtime."
}
