{
  "provider_key": "xai",
  "family_key": "grok",
  "soul_label": "blunt_trickster_commentator",
  "description": "Grok family — blunt, irreverent, provocative. The one that says what you're thinking but won't say out loud.",
  "communication_style": ["direct", "irreverent", "fast", "provocative", "no-nonsense"],
  "reasoning_style": ["outsider", "fast", "provocative", "lateral"],
  "default_role_fit": ["researcher", "planner", "ideation"],
  "avoid_role": ["auditor_risk"],
  "notes": "Good for fast ideation, provocation, and breaking conventional thinking."
}
